{
  "$schema": "https://pycsamt.org/schemas/pcbh/0.1/schema.json",
  "pcbh_version": "0.1.0",
  "document_id": "example:multiple-deviated",
  "created_at": "2026-08-28T12:00:00Z",
  "created_by": "pycsamt test fixture",
  "crs": {
    "horizontal": "LOCAL:project-grid",
    "vertical": "LOCAL:project-datum",
    "axis_order": "xy",
    "coordinate_unit": "m"
  },
  "units": {"depth": "m", "diameter": "m", "angle": "deg", "resistivity": "ohm.m"},
  "conventions": {
    "depth_reference": "collar",
    "z_positive": "up",
    "azimuth_direction": "clockwise",
    "inclination_reference": "vertical_down"
  },
  "dictionaries": {
    "lithologies": [
      {"code": "SAPR", "name": "Saprolite", "color": "#C69C6D"},
      {"code": "GRAN", "name": "Granite", "color": "#E8A96B"}
    ]
  },
  "boreholes": [
    {
      "id": "DH-01",
      "name": "DH-01",
      "kind": "mining_exploration",
      "status": "completed",
      "collar": {"x": 100.0, "y": 200.0, "z": 50.0},
      "total_depth_md": 125.0,
      "trajectory": {
        "method": "survey",
        "north_reference": "grid",
        "desurvey_method": "minimum_curvature",
        "stations": [
          {"md": 0.0, "azimuth_deg": 34.0, "inclination_deg": 4.5},
          {"md": 60.0, "azimuth_deg": 36.0, "inclination_deg": 6.0},
          {"md": 125.0, "azimuth_deg": 38.0, "inclination_deg": 8.0}
        ]
      },
      "interval_logs": {
        "lithology": [
          {"from_md": 0.0, "to_md": 48.0, "code": "SAPR", "data_nature": "observed"},
          {"from_md": 48.0, "to_md": 125.0, "code": "GRAN", "data_nature": "observed"}
        ]
      },
      "structures": [
        {
          "kind": "fracture",
          "at_md": 73.4,
          "orientation_representation": "global_plane",
          "dip_deg": 57.0,
          "dip_direction_deg": 128.0,
          "aperture_m": 0.003,
          "data_nature": "observed",
          "confidence": 0.8
        }
      ]
    },
    {
      "id": "DH-02",
      "name": "DH-02",
      "kind": "geotechnical",
      "status": "drilling",
      "collar": {"x": 160.0, "y": 240.0, "z": 51.0},
      "total_depth_md": 45.0,
      "trajectory": {
        "method": "vertical",
        "north_reference": "unknown",
        "desurvey_method": "minimum_curvature",
        "stations": []
      },
      "interval_logs": {},
      "structures": []
    }
  ]
}
