{
  "$schema": "https://pycsamt.org/schemas/pcbh/0.1/schema.json",
  "pcbh_version": "0.1.0",
  "document_id": "example:minimal-vertical",
  "title": "Minimal vertical borehole",
  "created_at": "2026-08-28T12:00:00Z",
  "created_by": "pyCSAMT project",
  "crs": {
    "horizontal": "EPSG:32629",
    "vertical": "unknown",
    "axis_order": "xy",
    "coordinate_unit": "m"
  },
  "units": {
    "depth": "m",
    "diameter": "m",
    "angle": "deg",
    "resistivity": "ohm.m"
  },
  "conventions": {
    "depth_reference": "collar",
    "z_positive": "up",
    "azimuth_direction": "clockwise",
    "inclination_reference": "vertical_down"
  },
  "dictionaries": {
    "lithologies": [
      {"code": "SOIL", "name": "Soil", "color": "#8B5A2B"},
      {"code": "GRAN", "name": "Granite", "color": "#E8A96B"}
    ]
  },
  "boreholes": [
    {
      "id": "BH-001",
      "name": "BH-001",
      "kind": "water",
      "status": "completed",
      "collar": {"x": 421550.2, "y": 1048230.7, "z": 347.5},
      "total_depth_md": 80.0,
      "trajectory": {
        "method": "vertical",
        "north_reference": "unknown",
        "desurvey_method": "minimum_curvature",
        "stations": []
      },
      "interval_logs": {
        "lithology": [
          {"from_md": 0.0, "to_md": 12.0, "code": "SOIL", "data_nature": "observed"},
          {"from_md": 12.0, "to_md": 80.0, "code": "GRAN", "data_nature": "observed"}
        ]
      },
      "structures": []
    }
  ]
}
